status,title,slug,category,primary_keyword,secondary_keywords,target_city,word_count,read_time,post_to_social
pending,How Much Does House Cleaning Cost in Atlanta? (2025 Price Guide),house-cleaning-cost-atlanta-2025,Pricing,house cleaning cost atlanta,maid service prices atlanta;cleaning rates georgia;professional cleaning cost,Atlanta,1500,7,yes
pending,House Cleaning Services in Alpharetta GA: Pricing Tips & Top Companies (2025),house-cleaning-alpharetta-ga,Local Guide,house cleaning alpharetta ga,maid service alpharetta;cleaning services alpharetta;alpharetta home cleaning,Alpharetta,1500,7,yes
pending,Sandy Springs House Cleaning: What Residents Need to Know (2025 Guide),house-cleaning-sandy-springs-ga,Local Guide,house cleaning sandy springs,maid service sandy springs ga;sandy springs cleaning services,Sandy Springs,1500,7,yes
pending,Deep Cleaning vs Regular Cleaning: What's the Difference and Which Do You Need?,deep-cleaning-vs-regular-cleaning,Tips,deep cleaning vs regular cleaning,what is deep cleaning;professional deep cleaning;cleaning comparison,Atlanta,1800,8,yes
pending,Buckhead House Cleaning Services: Premium Cleaning for Atlanta's Finest Homes,house-cleaning-buckhead-atlanta,Local Guide,house cleaning buckhead,buckhead maid service;luxury home cleaning atlanta;buckhead cleaning,Buckhead,1500,7,yes
pending,How Long Does a Professional House Cleaning Take? (By Home Size),how-long-house-cleaning-takes,Tips,how long does cleaning take,professional cleaning time;cleaning duration;house cleaning hours,Atlanta,1200,6,no
pending,What's Included in a Standard House Cleaning Service?,standard-cleaning-service-includes,Tips,what is included in house cleaning,standard cleaning checklist;cleaning service includes,Atlanta,1200,6,no
pending,Dunwoody House Cleaning: Professional Services Prices & Scheduling,house-cleaning-dunwoody-ga,Local Guide,house cleaning dunwoody ga,dunwoody maid service;dunwoody cleaning,Dunwoody,1500,7,yes
pending,Move-In/Move-Out Cleaning Guide: Get Your Deposit Back (Complete Checklist),move-in-move-out-cleaning-guide,Guide,move out cleaning,move in cleaning;apartment cleaning before moving;deposit cleaning,Atlanta,2000,9,yes
pending,Johns Creek House Cleaning: Trusted Cleaning Services for Families,house-cleaning-johns-creek-ga,Local Guide,house cleaning johns creek,johns creek maid service;johns creek cleaning,Johns Creek,1500,7,yes
pending,How to Choose the Best Cleaning Company (Red Flags to Avoid),how-to-choose-cleaning-company,Tips,how to choose cleaning service,best cleaning company;what to look for cleaning,Atlanta,1500,7,no
pending,Weekly vs Bi-Weekly vs Monthly Cleaning: Which Frequency is Right for You?,cleaning-frequency-guide,Tips,how often should I clean,weekly vs biweekly cleaning;cleaning schedule,Atlanta,1400,7,no
